{
  "$schema": "https://json-schema.org/draft/2020-12/schema",
  "$id": "https://cza.invalid/schemas/rbac-state-v4.json",
  "type": "object",
  "required": ["schemaVersion", "states", "transitions", "explicitlyForbidden", "separationOfDuties", "tenantBinding", "hmacRoleMetadata"],
  "properties": {
    "schemaVersion": { "const": "CZA-RBAC-STATE-V4" },
    "states": { "const": ["draft", "review", "approved", "published", "withdrawn"] },
    "transitions": { "type": "array", "minItems": 7 },
    "explicitlyForbidden": { "type": "array", "minItems": 1 },
    "separationOfDuties": { "type": "object" },
    "tenantBinding": { "type": "object" },
    "hmacRoleMetadata": { "type": "object" }
  },
  "additionalProperties": false
}
